headline,article_link,is_sarcastic,date
Your Silicon Valley Scammer Kit,https://www.newyorker.com//humor/daily-shouts/your-silicon-valley-scammer-kit,1,"March 29, 2019"
"Daily Cartoon: Friday, March 29th",https://www.newyorker.com//cartoons/daily-cartoon/friday-march-29th-barr-report,1,"March 29, 2019"
"If You Ask Me: Super-Nice, or How to Be a Female Superhero Who Stops an Interplanetary Genocide Without Messing Up Her Hair",https://www.newyorker.com//humor/daily-shouts/if-you-ask-me-super-nice-or-how-to-be-a-female-superhero-who-stops-an-interplanetary-genocide-without-messing-up-her-hair,1,"March 29, 2019"
Upgrading to a Flip Phone,https://www.newyorker.com//humor/daily-shouts/upgrading-to-a-flip-phone,1,"March 28, 2019"
"Daily Cartoon: Thursday, March 28th",https://www.newyorker.com//cartoons/daily-cartoon/thursday-march-28th-mr-met-citi-field,1,"March 28, 2019"
The Ecstatic Beauty of Baseball,https://www.newyorker.com//humor/daily-shouts/the-ecstatic-beauty-of-baseball,1,"March 28, 2019"
Secret Shames of the “Queer Eye” Guys,https://www.newyorker.com//humor/daily-shouts/secret-shames-of-the-queer-eye-guys,1,"March 27, 2019"
"Daily Cartoon: Wednesday, March 27th",https://www.newyorker.com//cartoons/daily-cartoon/wednesday-march-27th-robert-mueller,1,"March 27, 2019"
The First Legal Russian-Collusion Dispensaries,https://www.newyorker.com//humor/daily-shouts/the-first-legal-russian-collusion-dispensaries,1,"March 27, 2019"
They’re Running: The Latest 2020 Presidential Wannabes,https://www.newyorker.com//humor/daily-shouts/theyre-running-the-latest-2020-presidential-wannabes,1,"March 26, 2019"
"William Barr Reads “Moby-Dick,” Finds No Evidence of Whales",https://www.newyorker.com//humor/borowitz-report/william-barr-reads-moby-dick-finds-no-evidence-of-whales,1,"March 26, 2019"
"Daily Cartoon: Tuesday, March 26th",https://www.newyorker.com//cartoons/daily-cartoon/tuesday-march-26th-mitch-mcconnell,1,"March 26, 2019"
What Dry Cleaners Do,https://www.newyorker.com//humor/daily-shouts/what-dry-cleaners-do,1,"March 26, 2019"
Bonus Daily Cartoon: After the Mueller Report,https://www.newyorker.com//cartoons/daily-cartoon/bonus-after-the-mueller-report,1,"March 25, 2019"
America!: Animal Influencers of the Nineteen-Twenties,https://www.newyorker.com//humor/daily-shouts/america-animal-influencers-of-the-nineteen-twenties,1,"March 25, 2019"
"Daily Cartoon: Monday, March 25th",https://www.newyorker.com//cartoons/daily-cartoon/monday-march-25th-mueller-report-trumpzilla,1,"March 25, 2019"
Mail from Mom,https://www.newyorker.com//humor/daily-shouts/mail-from-mom,1,"March 24, 2019"
The Job Creator Rises at Dawn,https://www.newyorker.com//humor/daily-shouts/the-job-creator-rises-at-dawn,1,"March 23, 2019"
How the Mueller Report Fixed Everything,https://www.newyorker.com//humor/daily-shouts/how-the-mueller-report-fixed-everything,1,"March 22, 2019"
Bonus Daily Cartoon: The Contents of the Mueller Report,https://www.newyorker.com//cartoons/daily-cartoon/bonus-daily-cartoon-the-contents-of-the-mueller-report,1,"March 22, 2019"
Easy Ways to Feel Youthful Again,https://www.newyorker.com//humor/daily-shouts/easy-ways-to-feel-youthful-again,1,"March 22, 2019"
"Daily Cartoon: Friday, March 22nd",https://www.newyorker.com//cartoons/daily-cartoon/friday-march-22nd-first-day-of-spring,1,"March 22, 2019"
How My Weekend Plans Changed After I Got a Weighted Blanket,https://www.newyorker.com//humor/daily-shouts/how-my-weekend-plans-changed-after-i-got-a-weighted-blanket,1,"March 22, 2019"
Dear Pepper: Doggedly Pursuing Someone and College Anxiety,https://www.newyorker.com//humor/daily-shouts/dear-pepper-doggedly-pursuing-someone-and-college-anxiety,1,"March 21, 2019"
"Daily Cartoon: Thursday, March 21st",https://www.newyorker.com//cartoons/daily-cartoon/thursday-march-21st-trump-mccain,1,"March 21, 2019"
Real Men Hate Toxic Masculinity,https://www.newyorker.com//humor/daily-shouts/real-men-hate-toxic-masculinity,1,"March 21, 2019"
Contestants on “The Bachelor” in an Apocalyptic Future,https://www.newyorker.com//humor/daily-shouts/contestants-on-the-bachelor-in-an-apocalyptic-future,1,"March 20, 2019"
"Daily Cartoon: Wednesday, March 20th",https://www.newyorker.com//cartoons/daily-cartoon/wednesday-march-20th-spring,1,"March 20, 2019"
Night Clubs for People Over Thirty,https://www.newyorker.com//humor/daily-shouts/night-clubs-for-people-over-thirty,1,"March 20, 2019"
Conversations with Ma: Clearing Out the Attic,https://www.newyorker.com//humor/daily-shouts/conversations-with-ma-clearing-out-the-attic,1,"March 19, 2019"
"Daily Cartoon: Tuesday, March 19th",https://www.newyorker.com//cartoons/daily-cartoon/tuesday-march-19th-trump-deutsche-bank,1,"March 19, 2019"
Welcome to the Digicontenthub Team!,https://www.newyorker.com//humor/daily-shouts/welcome-to-the-digicontenthub-team,1,"March 19, 2019"
Bonus Daily Cartoon: Fitting,https://www.newyorker.com//cartoons/daily-cartoon/bonus-cartoon-paul-manafort-fitting,1,"March 18, 2019"
Every Hairdresser I’ve Ever Had: A Comprehensive Review,https://www.newyorker.com//humor/daily-shouts/every-hairdresser-ive-ever-had-a-comprehensive-review,1,"March 18, 2019"
"Daily Cartoon: Monday, March 18th",https://www.newyorker.com//cartoons/daily-cartoon/monday-march-18th-teen-age-girls,1,"March 18, 2019"
Natural Phenomena as Observed on the N.Y.C. Subway,https://www.newyorker.com//humor/daily-shouts/natural-phenomena-as-observed-on-the-nyc-subway,1,"March 17, 2019"
Respectful Ways to Heckle Athletes,https://www.newyorker.com//humor/daily-shouts/respectful-ways-to-heckle-athletes,1,"March 16, 2019"
Stuff My Dog Barked At This Week,https://www.newyorker.com//humor/daily-shouts/stuff-my-dog-barked-at-this-week,1,"March 15, 2019"
"Daily Cartoon: Friday, March 15th",https://www.newyorker.com//cartoons/daily-cartoon/friday-march-15th-tax-cuts,1,"March 15, 2019"
Beto O’Rourke Rocked by Scandal as High-School Mixtape Appears to Include REO Speedwagon,https://www.newyorker.com//humor/borowitz-report/beto-orourke-rocked-by-scandal-as-high-school-mixtape-appears-to-include-reo-speedwagon,1,"March 15, 2019"
The Last Supper: A Group Birthday Dinner,https://www.newyorker.com//humor/daily-shouts/the-last-supper-a-group-birthday-dinner,1,"March 15, 2019"
Food Mission Statements,https://www.newyorker.com//humor/daily-shouts/food-mission-statements,1,"March 14, 2019"
"Daily Cartoon: Thursday, March 14th",https://www.newyorker.com//cartoons/daily-cartoon/thursday-march-14th-beto-orourke-democratic-field,1,"March 14, 2019"
Betsy DeVos Suggests That Bribing Colleges Helps Students Learn Math,https://www.newyorker.com//humor/borowitz-report/betsy-devos-suggests-that-bribing-colleges-helps-students-learn-math,1,"March 14, 2019"
Why I Was Late for Work Today,https://www.newyorker.com//humor/daily-shouts/why-i-was-late-for-work-today,1,"March 14, 2019"
First-Family Finery,https://www.newyorker.com//humor/daily-shouts/first-family-finery,1,"March 13, 2019"
"Daily Cartoon: Wednesday, March 13th",https://www.newyorker.com//cartoons/daily-cartoon/wednesday-march-13th-college-admissions,1,"March 13, 2019"
American Express Commercials for Millennials,https://www.newyorker.com//humor/daily-shouts/american-express-commercials-for-millennials,1,"March 13, 2019"
Time Line of Watching a Twenty-Year-Old Prestige Drama,https://www.newyorker.com//humor/daily-shouts/timeline-of-watching-a-twenty-year-old-prestige-drama,1,"March 12, 2019"
"Daily Cartoon: Tuesday, March 12th",https://www.newyorker.com//cartoons/daily-cartoon/tuesday-march-12th-tucker-carlson,1,"March 12, 2019"
Murder Mysteries for Older Readers,https://www.newyorker.com//humor/daily-shouts/murder-mysteries-for-older-readers,1,"March 12, 2019"
Trump’s Budget Contains Twenty Million Dollars for Bail,https://www.newyorker.com//humor/borowitz-report/trumps-budget-contains-twenty-million-dollars-for-bail,1,"March 11, 2019"
Things My Brain Is Not Yet Evolved Enough to Do,https://www.newyorker.com//humor/daily-shouts/things-my-brain-is-not-yet-evolved-enough-to-do,1,"March 11, 2019"
"Daily Cartoon: Monday, March 11th",https://www.newyorker.com//cartoons/daily-cartoon/monday-march-11th-melania-trump,1,"March 11, 2019"
Cut and Paste: TV Antennas,https://www.newyorker.com//humor/daily-shouts/cut-and-paste-tv-antennas,1,"March 10, 2019"
God Offers People of Alabama New Bibles to Replace Ones Trump Signed,https://www.newyorker.com//humor/borowitz-report/god-offers-people-of-alabama-new-bibles-to-replace-ones-trump-signed,1,"March 9, 2019"
They Ruined the App,https://www.newyorker.com//humor/daily-shouts/they-ruined-the-app,1,"March 9, 2019"
Reasons I Did Not Exercise For Over Twenty Years,https://www.newyorker.com//humor/daily-shouts/reasons-i-did-not-exercise-for-over-twenty-years,1,"March 8, 2019"
"Daily Cartoon: Friday, March 8th",https://www.newyorker.com//cartoons/daily-cartoon/friday-march-8th-manafort-sentence,1,"March 8, 2019"
Tips for Writing a Novel,https://www.newyorker.com//humor/daily-shouts/tips-for-writing-a-novel,1,"March 8, 2019"
Inspirational Misquotes on Reclaimed Wood,https://www.newyorker.com//humor/daily-shouts/inspirational-misquotes-on-reclaimed-wood,1,"March 7, 2019"
"Daily Cartoon: Thursday, March 7th",https://www.newyorker.com//cartoons/daily-cartoon/thursday-march-7th-facebook,1,"March 7, 2019"
The Jonas Brothers Are Back!,https://www.newyorker.com//humor/daily-shouts/the-jonas-brothers-are-back,1,"March 7, 2019"
The New York Times and the New York Post Walk Into a Bar,https://www.newyorker.com//humor/daily-shouts/the-new-york-times-and-the-new-york-post-walk-into-a-bar,1,"March 6, 2019"
"Daily Cartoon: Wednesday, March 6th",https://www.newyorker.com//cartoons/daily-cartoon/wednesday-march-6th-white-house-clearance,1,"March 6, 2019"
Obama Demands to See Trump’s Elementary-School Diploma,https://www.newyorker.com//humor/borowitz-report/obama-demands-to-see-trumps-elementary-school-diploma,1,"March 6, 2019"
#BestPresident,https://www.newyorker.com//humor/daily-shouts/bestpresident,1,"March 6, 2019"
"Daily Cartoon: Tuesday, March 5th",https://www.newyorker.com//cartoons/daily-cartoon/tuesday-march-5th-trump-collusion,1,"March 5, 2019"
So You Have Some Questions About CBD,https://www.newyorker.com//humor/daily-shouts/so-you-have-some-questions-about-cbd,1,"March 5, 2019"
Hitchcock for City Dwellers,https://www.newyorker.com//humor/daily-shouts/hitchcock-for-city-dwellers,1,"March 4, 2019"
"Daily Cartoon: Monday, March 4th",https://www.newyorker.com//cartoons/daily-cartoon/monday-march-4th-snowman-hamlet,1,"March 4, 2019"
How a Dog Got Its Name,https://www.newyorker.com//humor/daily-shouts/how-a-dog-got-its-name,1,"March 3, 2019"
Philosophical Maxims Updated for Freelancers,https://www.newyorker.com//humor/daily-shouts/philosophical-maxims-updated-for-freelancers,1,"March 2, 2019"
Trump Storms Out of McDonald’s After Failing to Close Six-Dollar Meal Deal,https://www.newyorker.com//humor/borowitz-report/trump-storms-out-of-mcdonalds-after-failing-to-close-six-dollar-meal-deal,1,"March 1, 2019"
Places My Cat Sleeps Other Than His Cat Bed,https://www.newyorker.com//humor/daily-shouts/places-my-cat-sleeps-other-than-his-cat-bed,1,"March 1, 2019"
"Daily Cartoon: Friday, March 1st",https://www.newyorker.com//cartoons/daily-cartoon/friday-march-1st-confidential-sat-scores,1,"March 1, 2019"
Highest-Paying College Degrees for 2019,https://www.newyorker.com//humor/daily-shouts/highest-paying-college-degrees-for-2019,1,"March 1, 2019"
Luxury-Design Theme-Apartment Hacks,https://www.newyorker.com//humor/daily-shouts/luxury-design-theme-apartment-hacks,1,"February 28, 2019"
"Daily Cartoon: Thursday, February 28th",https://www.newyorker.com//cartoons/daily-cartoon/thursday-february-28th-trump-watches-cohen,1,"February 28, 2019"
Mueller Says He Has Obtained Trump’s SAT Scores,https://www.newyorker.com//humor/borowitz-report/mueller-says-he-has-obtained-trumps-sat-scores,1,"February 28, 2019"
Sorry You’re Not Feeling Well! Have You Tried . . .,https://www.newyorker.com//humor/daily-shouts/sorry-youre-not-feeling-well-have-you-tried,1,"February 28, 2019"
Cohen Testimony Leaves Kim Jong Un Doubting Whether Trump Can Be Trusted,https://www.newyorker.com//humor/borowitz-report/cohen-testimony-leaves-kim-jong-un-doubting-whether-trump-can-be-trusted,1,"February 27, 2019"
Conversations with Ma: My Mother’s Daughter and a Walk with Ma,https://www.newyorker.com//humor/daily-shouts/conversations-with-ma-my-mothers-daughter-and-a-walk-with-ma,1,"February 27, 2019"
"Daily Cartoon: Wednesday, February 27th",https://www.newyorker.com//cartoons/daily-cartoon/wednesday-february-27th-north-korea-michael-cohen,1,"February 27, 2019"
Sarah Huckabee Sanders Warns Michael Cohen to Leave Lying to Professionals,https://www.newyorker.com//humor/borowitz-report/sarah-huckabee-sanders-warns-michael-cohen-to-leave-lying-to-professionals,1,"February 27, 2019"
Seventeen E-mails Telling You That You Have Unsubscribed from Our E-mail List,https://www.newyorker.com//humor/daily-shouts/seventeen-e-mails-telling-you-that-you-have-unsubscribed-from-our-e-mail-list,1,"February 27, 2019"
When Life (Your C.S.A.) Gives You . . .,https://www.newyorker.com//humor/daily-shouts/when-life-your-csa-gives-you,1,"February 26, 2019"
"Daily Cartoon: Tuesday, February 26th",https://www.newyorker.com//cartoons/daily-cartoon/tuesday-february-26th-north-korea-dictators,1,"February 26, 2019"
Fashion Tips for Tired Women,https://www.newyorker.com//humor/daily-shouts/fashion-tips-for-tired-women,1,"February 26, 2019"
N.Y.C. Tourist Photos I’ve Appeared in Through the Years,https://www.newyorker.com//humor/daily-shouts/nyc-tourist-photos-ive-appeared-in-through-the-years,1,"February 25, 2019"
"Daily Cartoon: Monday, February 25th",https://www.newyorker.com//cartoons/daily-cartoon/monday-february-25th-oscars-tweets,1,"February 25, 2019"
It’s a Bad Sign: Inappropriate Fonts,https://www.newyorker.com//humor/daily-shouts/its-a-bad-sign-inappropriate-fonts,1,"February 24, 2019"
Rosie O’Donnell Chosen to Read Audiobook of Mueller Report,https://www.newyorker.com//humor/borowitz-report/rosie-odonnell-chosen-to-read-audiobook-of-mueller-report,1,"February 23, 2019"
Terms Your Noncommittal Ex Prefers to “Relationship”,https://www.newyorker.com//humor/daily-shouts/what-your-noncommittal-ex-would-prefer-you-call-your-short-term-relationship-instead-of-relationship,1,"February 23, 2019"
America!: Special Agents Scully and Mulder Take Over the Mueller Investigation,https://www.newyorker.com//humor/daily-shouts/america-special-agents-scully-and-mulder-take-over-the-mueller-investigation,1,"February 22, 2019"
"Daily Cartoon: Friday, February 22nd",https://www.newyorker.com//cartoons/daily-cartoon/friday-february-22nd-oscars,1,"February 22, 2019"
2019 Best Picture Nominees to Watch While Also on Your Phone,https://www.newyorker.com//humor/daily-shouts/2019-best-pictures-to-watch-while-also-on-your-phone,1,"February 22, 2019"
"Dear Pepper: A Couple in a New City, and An Unkind Letter",https://www.newyorker.com//humor/daily-shouts/dear-pepper-a-couple-in-a-new-city-and-an-unkind-letter,1,"February 21, 2019"
"Daily Cartoon: Thursday, February 21st",https://www.newyorker.com//cartoons/daily-cartoon/thursday-february-21st-instagram-winter,1,"February 21, 2019"
Your Stripper Name,https://www.newyorker.com//humor/daily-shouts/your-stripper-name,1,"February 21, 2019"
Bezos Says Amazon Drones Ready to Deliver Mueller Report to Every American Household,https://www.newyorker.com//humor/borowitz-report/bezos-says-amazon-drones-ready-to-deliver-mueller-report-to-every-american-household,1,"February 20, 2019"
A Road-Work Nightmare,https://www.newyorker.com//humor/daily-shouts/a-road-work-nightmare,1,"February 20, 2019"
"Daily Cartoon: Wednesday, February 20th",https://www.newyorker.com//cartoons/daily-cartoon/wednesday-february-20th-winter-dogs,1,"February 20, 2019"
Things I’m Not Old Enough for Even Though I’m Definitely Old Enough to Be a Parent,https://www.newyorker.com//humor/daily-shouts/things-im-not-old-enough-for-even-though-im-definitely-old-enough-to-be-a-parent,1,"February 20, 2019"
Cereal-Box Games for Adults,https://www.newyorker.com//humor/daily-shouts/cereal-box-games-for-adults,1,"February 19, 2019"
Dukakis Announces 2020 Bid: “Everyone Else Is”,https://www.newyorker.com//humor/borowitz-report/dukakis-announces-2020-bid-everyone-else-is,1,"February 19, 2019"
"Daily Cartoon: Tuesday, February 19th",https://www.newyorker.com//cartoons/daily-cartoon/tuesday-february-19th-paying-attention,1,"February 19, 2019"
Winter Blahs,https://www.newyorker.com//humor/daily-shouts/winter-blahs,1,"February 19, 2019"
"Where Are They Now? Your Fake I.D., Twenty Years On",https://www.newyorker.com//humor/daily-shouts/where-are-they-now-your-fake-id-twenty-years-on,1,"February 18, 2019"
Updated Etiquette Posters from the M.T.A.,https://www.newyorker.com//humor/daily-shouts/updated-etiquette-posters-from-the-mta,1,"February 17, 2019"
"Howard Schultz, Who Doesn’t See Color, Critiques Colorful Cultural Products",https://www.newyorker.com//humor/daily-shouts/howard-schultz-who-doesnt-see-color-critiques-colorful-cultural-products,1,"February 16, 2019"
Real Broadway Musicals and What I Wish They Were About,https://www.newyorker.com//humor/daily-shouts/real-broadway-musicals-and-what-i-wish-they-were-about,1,"February 16, 2019"
How I’ll Get Out of Chelsea’s Bachelorette Party,https://www.newyorker.com//humor/daily-shouts/how-ill-get-out-of-chelseas-bachelorette-party,1,"February 15, 2019"
"Daily Cartoon: Friday, February 15th",https://www.newyorker.com//cartoons/daily-cartoon/friday-february-15th-national-emergency-plan,1,"February 15, 2019"
Notable Moments in the History of Fashion,https://www.newyorker.com//humor/daily-shouts/notable-moments-in-the-history-of-fashion,1,"February 15, 2019"
Jeff Bezos Chooses Soon-to-Be Bankrupt Mar-a-Lago as New Amazon Headquarters,https://www.newyorker.com//humor/borowitz-report/jeff-bezos-chooses-soon-to-be-bankrupt-mar-a-lago-as-new-amazon-headquarters,1,"February 14, 2019"
Conciliatory Valentine’s Day Cards from Mom,https://www.newyorker.com//humor/daily-shouts/conciliatory-valentines-day-cards-from-mom,1,"February 14, 2019"
"Daily Cartoon: Thursday, February 14th",https://www.newyorker.com//cartoons/daily-cartoon/thursday-february-14th-love-isnt-blind-anymore,1,"February 14, 2019"
Valentine’s Day Poems from President Trump,https://www.newyorker.com//humor/daily-shouts/valentines-day-poems-from-president-trump,1,"February 14, 2019"
Before the Date,https://www.newyorker.com//humor/daily-shouts/before-the-date,1,"February 13, 2019"
"Daily Cartoon: Wednesday, February 13th",https://www.newyorker.com//cartoons/daily-cartoon/wednesday-february-13th-polar-bears-russia,1,"February 13, 2019"
El Chapo Says He Is Victim of Phony Witch Hunt,https://www.newyorker.com//humor/borowitz-report/el-chapo-says-he-is-victim-of-phony-witch-hunt,1,"February 13, 2019"
"If You Ask Me: Butts, Nuts, and Sluts, or February at the Movies",https://www.newyorker.com//humor/daily-shouts/if-you-ask-me-butts-nuts-and-sluts-or-february-at-the-movies,1,"February 13, 2019"
What to Tell Your Grandma Instead of “We Met on Tinder”,https://www.newyorker.com//humor/daily-shouts/what-to-tell-your-grandma-instead-of-we-met-on-tinder,1,"February 12, 2019"
"Daily Cartoon: Tuesday, February 12th",https://www.newyorker.com//cartoons/daily-cartoon/tuesday-february-12th-westminster-gerbil-show,1,"February 12, 2019"
Affordable Valentine’s Day Gifts for a Generation of People Who Will Probably Never Be Able to Afford Their Own Homes,https://www.newyorker.com//humor/daily-shouts/affordable-valentines-day-gifts-for-members-of-a-generation-that-will-probably-never-be-able-to-afford-their-own-homes,1,"February 12, 2019"
Meet Mr. Long Legs,https://www.newyorker.com//humor/daily-shouts/meet-mr-long-legs,1,"February 11, 2019"
"Daily Cartoon: Monday, February 11th",https://www.newyorker.com//cartoons/daily-cartoon/monday-february-11th-muellers-got-it,1,"February 11, 2019"
The Cooking Cartoonist: A Restaurant Week Story,https://www.newyorker.com//humor/daily-shouts/the-cooking-cartoonist-a-restaurant-week-story,1,"February 10, 2019"
The Howard Schultz Scripts,https://www.newyorker.com//humor/daily-shouts/the-howard-schultz-scripts,1,"February 9, 2019"
Excerpts from the Book That Man Is Reading on the Subway,https://www.newyorker.com//humor/daily-shouts/excerpts-from-the-book-that-man-is-reading-on-the-subway,1,"February 9, 2019"
Modern Romance,https://www.newyorker.com//humor/daily-shouts/modern-romance,1,"February 8, 2019"
"Daily Cartoon: Friday, February 8th",https://www.newyorker.com//cartoons/daily-cartoon/friday-february-8th-other-centrists-2020,1,"February 8, 2019"
Evel Knievel’s Academic Stunts,https://www.newyorker.com//humor/daily-shouts/evel-knievels-academic-stunts,1,"February 8, 2019"
Predictions for Fashion Week,https://www.newyorker.com//humor/daily-shouts/predictions-for-fashion-week,1,"February 7, 2019"
Republicans Blast Alexandria Ocasio-Cortez’s Sour Expression During State of the Union Address,https://www.newyorker.com//humor/borowitz-report/republicans-blast-alexandria-ocasio-cortezs-sour-expression-during-state-of-the-union-address,1,"February 7, 2019"
"People, Images, and Items Mistakenly Tagged as Melania Trump on Social Media",https://www.newyorker.com//humor/daily-shouts/people-images-and-items-mistakenly-tagged-as-melania-trump-on-social-media,1,"February 7, 2019"
"Daily Cartoon: Thursday, February 7th",https://www.newyorker.com//cartoons/daily-cartoon/thursday-february-7th-tie-of-damocles,1,"February 7, 2019"
"Daily Cartoon: Wednesday, February 6th",https://www.newyorker.com//cartoons/daily-cartoon/wednesday-february-6th-state-of-the-union-recap,1,"February 6, 2019"
Chekhov’s Other Dramatic Principles,https://www.newyorker.com//humor/daily-shouts/chekhovs-other-dramatic-principles,1,"February 6, 2019"
Greta Van Fleet: Some Possible Explanations,https://www.newyorker.com//humor/daily-shouts/greta-van-fleet-some-possible-explanations,1,"February 5, 2019"
Bonus Daily Cartoon: The State of the Union,https://www.newyorker.com//cartoons/daily-cartoon/bonus-daily-cartoon-warhol-whopper-sotu,1,"February 5, 2019"
"Daily Cartoon: Tuesday, February 5th",https://www.newyorker.com//cartoons/daily-cartoon/tuesday-february-5th-state-of-the-union-drinking-game,1,"February 5, 2019"
Pence Begs Trump Not to Make Him Sit Next to Woman at State of the Union,https://www.newyorker.com//humor/borowitz-report/pence-begs-trump-not-to-make-him-sit-next-to-woman-at-state-of-the-union,1,"February 5, 2019"
The Great Brexit Bake Off,https://www.newyorker.com//humor/daily-shouts/the-great-brexit-bake-off,1,"February 5, 2019"
My Family’s Specialty Cleaning Supplies for Lunar New Year,https://www.newyorker.com//humor/daily-shouts/my-familys-specialty-cleaning-supplies-for-lunar-new-year,1,"February 4, 2019"
"Daily Cartoon: Monday, February 4th",https://www.newyorker.com//cartoons/daily-cartoon/monday-february-4th-boring-super-bowl,1,"February 4, 2019"
Americans Relieved to Learn That Trump Spends Sixty Per Cent of Time Not Using Powers as President,https://www.newyorker.com//humor/borowitz-report/americans-relieved-to-learn-that-trump-spends-sixty-per-cent-of-time-not-using-powers-as-president,1,"February 4, 2019"
"Oh, Winter!",https://www.newyorker.com//humor/daily-shouts/oh-winter,1,"February 3, 2019"
I Like Sports,https://www.newyorker.com//humor/daily-shouts/i-like-sports,1,"February 2, 2019"
"Daily Cartoon: Saturday, February 2nd",https://www.newyorker.com//cartoons/daily-cartoon/saturday-february-2nd-groundhog-day-dystopia,1,"February 2, 2019"
The Secret Tattoos of the Trump Administration,https://www.newyorker.com//humor/daily-shouts/the-secret-tattoos-of-the-trump-administration,1,"February 1, 2019"
"Eris, Greek Goddess of Chaos, Confirms That She Wanted Trump to Be President",https://www.newyorker.com//humor/borowitz-report/eris-greek-goddess-of-chaos-confirms-that-she-wanted-trump-to-be-president,1,"February 1, 2019"
"Daily Cartoon: Friday, February 1st",https://www.newyorker.com//cartoons/daily-cartoon/friday-february-1st-super-bowl-halftime-mueller,1,"February 1, 2019"
Looking at This Thing on My Phone: A User’s Manual,https://www.newyorker.com//humor/daily-shouts/looking-at-this-thing-on-my-phone-a-users-manual,1,"February 1, 2019"
Cut and Paste: Strange Dialogues,https://www.newyorker.com//humor/daily-shouts/cut-and-paste-strange-dialogues,1,"January 31, 2019"
"Daily Cartoon: Thursday, January 31st",https://www.newyorker.com//cartoons/daily-cartoon/thursday-january-31st-2020-democrat,1,"January 31, 2019"
"I Refuse to Go Home Sick, Even If It Means Infecting the Entire Office",https://www.newyorker.com//humor/daily-shouts/i-refuse-to-go-home-sick-even-if-it-means-infecting-the-entire-office,1,"January 31, 2019"
Subtle Behavior Changes When My Roommates Are Out of Town,https://www.newyorker.com//humor/daily-shouts/subtle-behavior-changes-when-my-roommates-are-out-of-town,1,"January 30, 2019"
Trump Comes Out Strongly Against Intelligence,https://www.newyorker.com//humor/borowitz-report/trump-comes-out-strongly-against-intelligence,1,"January 30, 2019"
"Daily Cartoon: Wednesday, January 30th",https://www.newyorker.com//cartoons/daily-cartoon/wednesday-january-30th-radiator-band,1,"January 30, 2019"
Other Definitions of “Wintry Mix”,https://www.newyorker.com//humor/daily-shouts/other-definitions-of-wintry-mix,1,"January 30, 2019"
How Various Government Agencies Celebrated the End of the Shutdown,https://www.newyorker.com//humor/daily-shouts/how-various-government-agencies-celebrated-the-end-of-the-shutdown,1,"January 29, 2019"
"Daily Cartoon: Tuesday, January 29th",https://www.newyorker.com//cartoons/daily-cartoon/tuesday-january-29th-brexit-editor,1,"January 29, 2019"
