headline,article_link,is_sarcastic,date
"Carrier Employees, Soon to Be Laid Off, Feel Betrayed by Donald Trump",https://www.newyorker.com//news/news-desk/carrier-employees-soon-to-be-laid-off-feel-betrayed-by-donald-trump,1,"January 11, 2018"
"What a Judge’s DACA Ruling Means for Trump, and for Dreamers",https://www.newyorker.com//news/news-desk/what-a-judges-daca-ruling-means-for-trump-and-for-dreamers,1,"January 10, 2018"
Who Is Steve Bannon Without Breitbart?,https://www.newyorker.com//news/news-desk/who-is-steve-bannon-without-breitbart,1,"January 10, 2018"
What Kind of Senator Would Mitt Romney Be?,https://www.newyorker.com//news/news-desk/what-kind-of-senator-would-mitt-romney-be,1,"January 9, 2018"
What the Salvadorans Being Kicked Out by Trump Face Back Home,https://www.newyorker.com//news/news-desk/what-the-salvadorans-being-kicked-out-by-trump-face-back-home,1,"January 9, 2018"
Fighting Over Trump at the Georgia-Alabama Game,https://www.newyorker.com//news/news-desk/fighting-over-trump-at-the-georgia-alabama-game,1,"January 9, 2018"
Women Say a Rigged System Allows Wall Street to Hide Its Sexual-Harassment Problem,https://www.newyorker.com//news/news-desk/women-say-rigged-system-allows-wall-street-to-hide-sexual-harassment-problem,1,"January 7, 2018"
"In Calling for Politicians’ Arrest, an ICE Official Embraces His New Extremist Image",https://www.newyorker.com//news/news-desk/in-calling-for-politicians-arrest-an-ice-official-embraces-his-new-extremist-image,1,"January 4, 2018"
Iran in Turmoil—to Trump’s Delight,https://www.newyorker.com//news/news-desk/iran-in-turmoil-to-trumps-delight,1,"January 2, 2018"
The N.B.A. General Manager Who’s a Food Blogger on the Side,https://www.newyorker.com//sports/sporting-scene/the-nba-general-manager-whos-a-food-blogger-on-the-side,1,"December 30, 2017"
Trump Reopens an Old Wound for Haitians,https://www.newyorker.com//news/news-desk/trump-reopens-an-old-wound-for-haitians,1,"December 29, 2017"
Why the 2018 Midterms Are So Vulnerable to Hackers,https://www.newyorker.com//news/news-desk/why-the-2018-midterms-are-so-vulnerable-to-hackers,1,"December 28, 2017"
"The Dream of Puerto Rican Independence, and the Story of Heriberto Marín",https://www.newyorker.com//news/news-desk/the-dream-of-puerto-rican-independence-and-the-story-of-heriberto-marin,1,"December 27, 2017"
The Power Politics Behind Trump’s Jerusalem Declaration,https://www.newyorker.com//news/news-desk/the-power-politics-behind-trumps-jerusalem-declaration,1,"December 26, 2017"
The Year That Marriage Equality Finally Came to Australia,https://www.newyorker.com//news/news-desk/the-year-that-marriage-equality-finally-came-to-australia,1,"December 26, 2017"
"A Conversation with A. G. Sulzberger, the New Leader of the New York Times",https://www.newyorker.com//news/news-desk/a-conversation-with-a-g-sulzberger-the-new-leader-of-the-new-york-times,1,"December 22, 2017"
Will Congress Save Dreamers Before Trump’s DACA Deadline?,https://www.newyorker.com//news/news-desk/will-congress-save-dreamers-before-trumps-daca-deadline,1,"December 22, 2017"
Trump Explodes After Biden Asks Him to Dog-Sit During G-7,https://www.newyorker.com//humor/borowitz-report/trump-explodes-after-biden-asks-him-to-dog-sit-during-g-7,1,"June 10, 2021"
"Daily Cartoon: Thursday, June 10th",https://www.newyorker.com//cartoons/daily-cartoon/thursday-june-10th-cancelling-plans,1,"June 10, 2021"
Places I’m Excited to Go Again,https://www.newyorker.com//humor/daily-shouts/places-im-excited-to-go-again,1,"June 10, 2021"
Dear Pepper: A Pregnant Pause,https://www.newyorker.com//humor/daily-shouts/dear-pepper-a-pregnant-pause,1,"June 9, 2021"
Susan Collins Sad That Joe Manchin Has Replaced Her as Most Annoying Senator,https://www.newyorker.com//humor/borowitz-report/susan-collins-sad-that-joe-manchin-has-replaced-her-as-most-annoying-senator,1,"June 9, 2021"
"Daily Cartoon: Wednesday, June 9th",https://www.newyorker.com//cartoons/daily-cartoon/wednesday-june-9th-bezos-in-space,1,"June 9, 2021"
A Food Critic Reviews the Swedish Chef’s New Restaurant,https://www.newyorker.com//humor/daily-shouts/a-food-critic-reviews-the-swedish-chefs-new-restaurant,1,"June 9, 2021"
"Daily Cartoon: Tuesday, June 8th",https://www.newyorker.com//cartoons/daily-cartoon/tuesday-june-8th-work-home,1,"June 8, 2021"
Compelling Reasons to Return to the Office,https://www.newyorker.com//humor/daily-shouts/compelling-reasons-to-return-to-the-office,1,"June 8, 2021"
Fashionable Ways to Let People Know You’re Vaccinated and Not a Maskless Asshole,https://www.newyorker.com//humor/daily-shouts/fashionable-ways-to-let-people-know-youre-vaccinated-and-not-a-maskless-asshole,1,"June 7, 2021"
Trump Explodes After Biden Asks Him to Dog-Sit During G-7,https://www.newyorker.com//humor/borowitz-report/trump-explodes-after-biden-asks-him-to-dog-sit-during-g-7,1,"June 10, 2021"
"Daily Cartoon: Thursday, June 10th",https://www.newyorker.com//cartoons/daily-cartoon/thursday-june-10th-cancelling-plans,1,"June 10, 2021"
Places I’m Excited to Go Again,https://www.newyorker.com//humor/daily-shouts/places-im-excited-to-go-again,1,"June 10, 2021"
Dear Pepper: A Pregnant Pause,https://www.newyorker.com//humor/daily-shouts/dear-pepper-a-pregnant-pause,1,"June 9, 2021"
Susan Collins Sad That Joe Manchin Has Replaced Her as Most Annoying Senator,https://www.newyorker.com//humor/borowitz-report/susan-collins-sad-that-joe-manchin-has-replaced-her-as-most-annoying-senator,1,"June 9, 2021"
"Daily Cartoon: Wednesday, June 9th",https://www.newyorker.com//cartoons/daily-cartoon/wednesday-june-9th-bezos-in-space,1,"June 9, 2021"
A Food Critic Reviews the Swedish Chef’s New Restaurant,https://www.newyorker.com//humor/daily-shouts/a-food-critic-reviews-the-swedish-chefs-new-restaurant,1,"June 9, 2021"
"Daily Cartoon: Tuesday, June 8th",https://www.newyorker.com//cartoons/daily-cartoon/tuesday-june-8th-work-home,1,"June 8, 2021"
Compelling Reasons to Return to the Office,https://www.newyorker.com//humor/daily-shouts/compelling-reasons-to-return-to-the-office,1,"June 8, 2021"
Fashionable Ways to Let People Know You’re Vaccinated and Not a Maskless Asshole,https://www.newyorker.com//humor/daily-shouts/fashionable-ways-to-let-people-know-youre-vaccinated-and-not-a-maskless-asshole,1,"June 7, 2021"
Putin Says He Has No Intention of Reinstating Trump,https://www.newyorker.com//humor/borowitz-report/putin-says-he-has-no-intention-of-reinstating-trump,1,"June 7, 2021"
"Daily Cartoon: Monday, June 7th",https://www.newyorker.com//cartoons/daily-cartoon/monday-june-7th-pandemic-pet,1,"June 7, 2021"
"So, You Want to Be a New Yorker Cartoonist",https://www.newyorker.com//humor/daily-shouts/so-you-want-to-be-a-new-yorker-cartoonist,1,"June 6, 2021"
Welcome to Netflix World,https://www.newyorker.com//humor/daily-shouts/welcome-to-netflix-world,1,"June 5, 2021"
How Can I Help You?,https://www.newyorker.com//humor/daily-shouts/how-can-i-help-you,1,"June 4, 2021"
"Daily Cartoon: Friday, June 4th",https://www.newyorker.com//cartoons/daily-cartoon/friday-june-4th-swimsuit-rotation,1,"June 4, 2021"
"I’m a Billionaire Politician, but Here’s Why You, a Regular Person, Have to Save the World",https://www.newyorker.com//humor/daily-shouts/im-a-billionaire-politician-but-heres-why-you-a-regular-person-have-to-save-the-world,1,"June 4, 2021"
How to Beat Out Cash Buyers When Trying to Buy Your First House,https://www.newyorker.com//humor/daily-shouts/how-to-beat-out-cash-buyers-when-trying-to-buy-your-first-house,1,"June 3, 2021"
"Daily Cartoon: Thursday, June 3rd",https://www.newyorker.com//cartoons/daily-cartoon/thursday-june-3rd-grab-drink,1,"June 3, 2021"
"Fairy Tales, but with Accessible Mental-Health Care",https://www.newyorker.com//humor/daily-shouts/fairy-tales-but-with-accessible-mental-health-care,1,"June 3, 2021"
"Daily Cartoon: Wednesday, June 2nd",https://www.newyorker.com//cartoons/daily-cartoon/wednesday-june-2nd-foot-massage,1,"June 2, 2021"
Trump to Be Reinstated in August as President of Trump University,https://www.newyorker.com//humor/borowitz-report/trump-to-be-reinstated-in-august-as-president-of-trump-university,1,"June 2, 2021"
I’m Totally Open to Anything,https://www.newyorker.com//humor/daily-shouts/im-totally-open-to-anything,1,"June 2, 2021"
A Small Sampling of Cafés,https://www.newyorker.com//humor/daily-shouts/a-small-sampling-of-cafes,1,"June 1, 2021"
Greg Abbott Tries to Lure Back Democratic Lawmakers by Offering NPR Tote Bags,https://www.newyorker.com//humor/borowitz-report/greg-abbott-tries-to-lure-back-democratic-lawmakers-by-offering-npr-tote-bags,1,"June 1, 2021"
"Daily Cartoon: Tuesday, June 1st",https://www.newyorker.com//cartoons/daily-cartoon/tuesday-june-1st-zoom-background,1,"June 1, 2021"
"Is He Not That Into You, or Is He a Time Traveller from the Late Eighteen-Hundreds Trying to Navigate the Perils of Modern Life",https://www.newyorker.com//humor/daily-shouts/is-he-not-that-into-you-or-is-he-a-time-traveller-from-the-late-eighteen-hundreds-trying-to-navigate-the-perils-of-modern-life,1,"June 1, 2021"
Surprise—It’s Your Clothes!,https://www.newyorker.com//humor/daily-shouts/surprise-its-your-clothes,1,"May 31, 2021"
"Daily Cartoon: Monday, May 31st",https://www.newyorker.com//cartoons/daily-cartoon/monday-may-31st-coming-back,1,"May 31, 2021"
New Flavors of Capitalism,https://www.newyorker.com//humor/daily-shouts/new-flavors-of-capitalism,1,"May 30, 2021"
School Announcement: Ms. B. Is Pivoting!,https://www.newyorker.com//humor/daily-shouts/school-announcement-ms-b-is-pivoting,1,"May 29, 2021"
Potential Spinoffs of HBO’s “Mare of Easttown”,https://www.newyorker.com//humor/daily-shouts/potential-spinoffs-of-hbos-mare-of-easttown,1,"May 28, 2021"
"Daily Cartoon: Friday, May 28th",https://www.newyorker.com//cartoons/daily-cartoon/friday-may-28th-social-reentry,1,"May 28, 2021"
My Grandmother’s Precious Heirlooms Versus My Precious Heirlooms,https://www.newyorker.com//humor/daily-shouts/my-grandmothers-precious-heirlooms-versus-my-precious-heirlooms,1,"May 28, 2021"
The Absurdities of Teaching Art During a Pandemic,https://www.newyorker.com//humor/daily-shouts/the-absurdities-of-teaching-art-during-a-pandemic,1,"May 27, 2021"
"Daily Cartoon: Thursday, May 27th",https://www.newyorker.com//cartoons/daily-cartoon/thursday-may-27th-vaccinated-friends,1,"May 27, 2021"
America!: Mystical Fixes for Our Crumbling Infrastructure,https://www.newyorker.com//humor/daily-shouts/america-mystical-fixes-for-our-crumbling-infrastructure,1,"May 26, 2021"
"Daily Cartoon: Wednesday, May 26th",https://www.newyorker.com//cartoons/daily-cartoon/wednesday-may-26th-party-math,1,"May 26, 2021"
"As Grand Jury Convenes, Trump Changes Name of His Company to Eric Trump Organization",https://www.newyorker.com//humor/borowitz-report/as-grand-jury-convenes-trump-changes-name-of-his-company-to-eric-trump-organization,1,"May 26, 2021"
When the Knicks Are Good,https://www.newyorker.com//humor/daily-shouts/when-the-knicks-are-good,1,"May 26, 2021"
"Daily Cartoon: Tuesday, May 25th",https://www.newyorker.com//cartoons/daily-cartoon/tuesday-may-25th-house-pfizer,1,"May 25, 2021"
A Baby Boomer’s Entertainment-Industry Advice,https://www.newyorker.com//humor/daily-shouts/a-baby-boomers-entertainment-industry-advice,1,"May 25, 2021"
Subway Reorientation: A Helpful Guide,https://www.newyorker.com//humor/daily-shouts/subway-reorientation-a-helpful-guide,1,"May 24, 2021"
"Daily Cartoon: Monday, May 24th",https://www.newyorker.com//cartoons/daily-cartoon/monday-may-24th-dylan-electric,1,"May 24, 2021"
Republicans Claim January 6th Rioters Were Middle Schoolers on Field Trip,https://www.newyorker.com//humor/borowitz-report/republicans-claim-january-6th-rioters-were-middle-schoolers-on-field-trip,1,"May 24, 2021"
No Worries if Not!,https://www.newyorker.com//humor/daily-shouts/no-worries-if-not,1,"May 23, 2021"
Biblical Travel Ads,https://www.newyorker.com//humor/daily-shouts/biblical-travel-ads,1,"May 22, 2021"
Some Barbie Backstories,https://www.newyorker.com//humor/daily-shouts/some-barbie-backstories,1,"May 21, 2021"
"Daily Cartoon: Friday, May 21st",https://www.newyorker.com//cartoons/daily-cartoon/friday-may-21st-restaurant-dining,1,"May 21, 2021"
Popular Parental Advice to Teens Throughout History,https://www.newyorker.com//humor/daily-shouts/popular-parental-advice-to-teens-throughout-history,1,"May 21, 2021"
Trump Orders Kevin McCarthy to Go to Prison in His Place,https://www.newyorker.com//humor/borowitz-report/trump-orders-kevin-mccarthy-to-go-to-prison-in-his-place,1,"May 20, 2021"
"Daily Cartoon: Thursday, May 20th",https://www.newyorker.com//cartoons/daily-cartoon/thursday-may-20th-bitcoin-nft,1,"May 20, 2021"
You’ll Feel Better if You Go Outside,https://www.newyorker.com//humor/daily-shouts/youll-feel-better-if-you-go-outside,1,"May 20, 2021"
Necessary Changes to the Olympics Because of COVID,https://www.newyorker.com//humor/daily-shouts/necessary-changes-to-the-olympics-because-of-covid,1,"May 19, 2021"
Kevin McCarthy Proposes Removing January 6th from Month of January,https://www.newyorker.com//humor/borowitz-report/kevin-mccarthy-proposes-removing-the-sixth-from-month-of-january,1,"May 19, 2021"
"Daily Cartoon: Wednesday, May 19th",https://www.newyorker.com//cartoons/daily-cartoon/wednesday-may-19th-pandemic-party,1,"May 19, 2021"
The Economic Value of This Article Is Dependent on Peri Gilpin’s Retweeting It,https://www.newyorker.com//humor/daily-shouts/the-economic-value-of-this-article-is-dependent-on-peri-gilpins-retweeting-it,1,"May 19, 2021"
"Daily Cartoon: Tuesday, May 18th",https://www.newyorker.com//cartoons/daily-cartoon/tuesday-may-18th-ballot-lessons,1,"May 18, 2021"
Trump Claims Arizona Audit Uncovered Widespread Math,https://www.newyorker.com//humor/borowitz-report/trump-claims-arizona-audit-uncovered-widespread-math,1,"May 18, 2021"
"We Can’t Ask Your Age in This Job Interview, but Please Take This Quiz About Rotary Phones",https://www.newyorker.com//humor/daily-shouts/we-cant-ask-your-age-in-this-job-interview-but-please-take-this-quiz-about-rotary-phones,1,"May 18, 2021"
"Daily Cartoon: Monday, May 17th",https://www.newyorker.com//cartoons/daily-cartoon/monday-may-17th-anti-maskers-or-vaccinated,1,"May 17, 2021"
Omaze Celebrity Charity Campaigns Nobody Bid On,https://www.newyorker.com//humor/daily-shouts/omaze-celebrity-charity-campaigns-nobody-bid-on,1,"May 17, 2021"
Respectable Book Covers,https://www.newyorker.com//humor/daily-shouts/respectable-book-covers,1,"May 16, 2021"
A Message from Your Brooklyn Private School’s Newly Elected Green Team President,https://www.newyorker.com//humor/daily-shouts/a-message-from-your-brooklyn-private-schools-newly-elected-green-team-president,1,"May 15, 2021"
Stefanik Solemnly Swears to Defend Trump from Constitution,https://www.newyorker.com//humor/borowitz-report/stefanik-solemnly-swears-to-defend-trump-from-constitution,1,"May 14, 2021"
A Million Big Pretty Tiny Little Lies Everywhere,https://www.newyorker.com//humor/daily-shouts/a-million-big-pretty-tiny-little-lies-everywhere,1,"May 14, 2021"
"Daily Cartoon: Friday, May 14th",https://www.newyorker.com//cartoons/daily-cartoon/friday-may-14th-guess-who-maskless,1,"May 14, 2021"
Jail Sale—Come on Down!,https://www.newyorker.com//humor/daily-shouts/jail-sale-come-on-down,1,"May 14, 2021"
How to Stay Busy While Waiting for New Episodes of “Call My Agent!”,https://www.newyorker.com//humor/daily-shouts/how-to-stay-busy-while-waiting-for-new-episodes-of-call-my-agent,1,"May 13, 2021"
"Daily Cartoon: Thursday, May 13th",https://www.newyorker.com//cartoons/daily-cartoon/thursday-may-13th-buy-gas,1,"May 13, 2021"
An Introduction to Asshole Cat Behaviors,https://www.newyorker.com//humor/daily-shouts/an-introduction-to-asshole-cat-behaviors,1,"May 13, 2021"
Elise Stefanik Replaces Ivanka as Trump’s Daughter,https://www.newyorker.com//humor/borowitz-report/elise-stefanik-replaces-ivanka-as-trumps-daughter,1,"May 12, 2021"
"Daily Cartoon: Wednesday, May 12th",https://www.newyorker.com//cartoons/daily-cartoon/wednesday-may-12th-bagel-vote,1,"May 12, 2021"
Fauci Says Nausea and Splitting Headache Are Symptoms of Talking to Rand Paul,https://www.newyorker.com//humor/borowitz-report/fauci-says-nausea-and-splitting-headache-are-symptoms-of-talking-to-rand-paul,1,"May 12, 2021"
My Coffee Shop Is Out of Oat Milk and I Am Not O.K.,https://www.newyorker.com//humor/daily-shouts/my-coffee-shop-is-out-of-oat-milk-and-i-am-not-ok,1,"May 12, 2021"
Kevin McCarthy Forced to Fly to Mar-a-Lago to Sit and Listen to Things Trump Would Have Posted on Facebook,https://www.newyorker.com//humor/borowitz-report/kevin-mccarthy-forced-to-fly-to-mar-a-lago-to-sit-and-listen-to-things-trump-would-have-posted-on-facebook,1,"May 11, 2021"
"Daily Cartoon: Tuesday, May 11th",https://www.newyorker.com//cartoons/daily-cartoon/tuesday-may-11th-knicks-good,1,"May 11, 2021"
"Jorge Luis Borges and Nancy Meyers Pitch a Movie (Because, Admit It, You’ve Watched Everything Else)",https://www.newyorker.com//humor/daily-shouts/jorge-luis-borges-and-nancy-meyers-pitch-a-movie-because-admit-it-youve-watched-everything-else,1,"May 11, 2021"
G.O.P. Claims Biden Is Artificially Inflating Job-Approval Rating By Displaying Competence,https://www.newyorker.com//humor/borowitz-report/gop-claims-biden-is-artificially-inflating-job-approval-rating-by-displaying-competence,1,"May 10, 2021"
Catching Up with Sisyphus,https://www.newyorker.com//humor/daily-shouts/catching-up-with-sisyphus,1,"May 10, 2021"
"Daily Cartoon: Monday, May 10th",https://www.newyorker.com//cartoons/daily-cartoon/monday-may-10th-rocket-fish,1,"May 10, 2021"
Customer Reviews of Mom: The V.R. Experience,https://www.newyorker.com//humor/daily-shouts/customer-reviews-of-mom-the-vr-experience,1,"May 9, 2021"
Villainous “S.N.L.” Hosts We’re Excited to See Next,https://www.newyorker.com//humor/daily-shouts/villainous-snl-hosts-were-excited-to-see-next,1,"May 8, 2021"
My Pandemic vs. a Tech Billionaire’s Pandemic,https://www.newyorker.com//humor/daily-shouts/my-pandemic-vs-a-tech-billionaires-pandemic,1,"May 7, 2021"
Millions Ask Facebook to Ban Their Relatives,https://www.newyorker.com//humor/borowitz-report/millions-ask-facebook-to-ban-their-relatives,1,"May 7, 2021"
"Daily Cartoon: Friday, May 7th",https://www.newyorker.com//cartoons/daily-cartoon/friday-may-7th-mothers-day,1,"May 7, 2021"
Dear Bill and/or Melinda,https://www.newyorker.com//humor/daily-shouts/dear-bill-andor-melinda,1,"May 7, 2021"
“Cyclopedia Exotica”: Grae Goes to Hollywood,https://www.newyorker.com//humor/daily-shouts/cyclopedia-exotica-grae-goes-to-hollywood,1,"May 6, 2021"
"Daily Cartoon: Thursday, May 6th",https://www.newyorker.com//cartoons/daily-cartoon/thursday-may-6th-become-cheugy,1,"May 6, 2021"
"Oh, Hey, I’m a Guy Who Peaked in the Aughts",https://www.newyorker.com//humor/daily-shouts/oh-hey-im-a-guy-who-peaked-in-the-aughts,1,"May 6, 2021"
Trump Urges Supporters to Follow Him on Facebook Total Landscaping,https://www.newyorker.com//humor/borowitz-report/trump-urges-supporters-to-follow-him-on-facebook-total-landscaping,1,"May 5, 2021"
"Daily Cartoon: Wednesday, May 5th",https://www.newyorker.com//cartoons/daily-cartoon/wednesday-may-5th-busy-day,1,"May 5, 2021"
Welcome to Our Microbrewery Tour!,https://www.newyorker.com//humor/daily-shouts/welcome-to-our-microbrewery-tour,1,"May 5, 2021"
Meet Your Nemesis,https://www.newyorker.com//humor/daily-shouts/meet-your-nemesis,1,"May 4, 2021"
"Daily Cartoon: Tuesday, May 4th",https://www.newyorker.com//cartoons/daily-cartoon/tuesday-may-4th-quarter-life,1,"May 4, 2021"
Sons of Commandment: Tales from the Nineties Bar-Mitzvah Circuit,https://www.newyorker.com//humor/daily-shouts/sons-of-commandment-tales-from-the-nineties-bar-mitzvah-circuit,1,"May 4, 2021"
DeSantis Says Florida Will Lift Coronavirus Restrictions to Focus on Voting Restrictions,https://www.newyorker.com//humor/daily-shouts/desantis-says-florida-will-lift-coronavirus-restrictions-to-focus-on-voting-restrictions,1,"May 3, 2021"
Impossible Puzzles for People Under Sixty,https://www.newyorker.com//humor/daily-shouts/impossible-puzzles-for-people-under-sixty,1,"May 3, 2021"
Thousands of Presidential Fact Checkers Laid Off in Biden’s First Hundred Days,https://www.newyorker.com//humor/borowitz-report/thousands-of-presidential-fact-checkers-laid-off-in-bidens-first-hundred-days,1,"May 3, 2021"
"Daily Cartoon: Monday, May 3rd",https://www.newyorker.com//cartoons/daily-cartoon/monday-may-3rd-side-effects,1,"May 3, 2021"
"Dealing with the Void, Distraction, and Yourself",https://www.newyorker.com//humor/daily-shouts/dealing-with-the-void-distraction-and-yourself,1,"May 2, 2021"
Here’s Why It Was O.K. to Do What We Did,https://www.newyorker.com//humor/daily-shouts/heres-why-it-was-ok-to-do-what-we-did,1,"May 1, 2021"
“Stone Fruit”: At the Playground,https://www.newyorker.com//humor/daily-shouts/stone-fruit-at-the-playground,1,"April 30, 2021"
"Daily Cartoon: Friday, April 30th",https://www.newyorker.com//cartoons/daily-cartoon/friday-april-30th-mask-guidelines,1,"April 30, 2021"
The Semi-Sadistic Seven-Minute Workout,https://www.newyorker.com//humor/daily-shouts/the-semi-sadistic-7-minute-workout,1,"April 29, 2021"
Explosive Video Reveals Biden Plot to Use His Power to Improve Living Conditions,https://www.newyorker.com//humor/borowitz-report/explosive-video-reveals-biden-plot-to-use-his-power-to-improve-living-conditions,1,"April 29, 2021"
"Daily Cartoon: Thursday, April 29th",https://www.newyorker.com//cartoons/daily-cartoon/thursday-april-29th-aliens-vaccine,1,"April 29, 2021"
Rejected Meet-Cutes for a Rom-Com About a Woman Who Falls in Love with the UPS Guy,https://www.newyorker.com//humor/daily-shouts/rejected-meet-cutes-for-a-rom-com-about-a-woman-who-falls-in-love-with-the-ups-guy,1,"April 29, 2021"
Welcome to Social Media,https://www.newyorker.com//humor/daily-shouts/welcome-to-social-media,1,"April 28, 2021"
Marjorie Taylor Greene Attacks Biden’s Plan for Free Preschool: “I Refuse to Go”,https://www.newyorker.com//humor/borowitz-report/marjorie-taylor-greene-attacks-bidens-plan-for-free-preschool-i-refuse-to-go,1,"April 28, 2021"
"Daily Cartoon: Wednesday, April 28th",https://www.newyorker.com//cartoons/daily-cartoon/wednesday-april-28th-fire-escape,1,"April 28, 2021"
"We Are in Month Fourteen of a Global Pandemic and I, Your Mother, Want You to Know That You’re Looking a Little Husky",https://www.newyorker.com//humor/daily-shouts/we-are-in-month-fourteen-of-a-global-pandemic-and-i-your-mother-want-you-to-know-that-youre-looking-a-little-husky,1,"April 28, 2021"
"Daily Cartoon: Tuesday, April 27th",https://www.newyorker.com//cartoons/daily-cartoon/tuesday-april-27th-shots-sniff,1,"April 27, 2021"
Are You a People Pleaser?: A Quiz,https://www.newyorker.com//humor/daily-shouts/are-you-a-people-pleaser-a-quiz,1,"April 27, 2021"
Penny Rejects the Rules of Man,https://www.newyorker.com//humor/daily-shouts/penny-rejects-the-rules-of-man,1,"April 26, 2021"
"Daily Cartoon: Monday, April 26th",https://www.newyorker.com//cartoons/daily-cartoon/april-26th-cicadas,1,"April 26, 2021"
Trump Blasts Biden for Firing Almost No One in First Hundred Days,https://www.newyorker.com//humor/borowitz-report/trump-blasts-biden-for-firing-almost-no-one-in-first-hundred-days,1,"April 25, 2021"
Internet Spam (for Spam),https://www.newyorker.com//humor/daily-shouts/internet-spam-for-spam,1,"April 25, 2021"
But I Can’t Complain,https://www.newyorker.com//humor/daily-shouts/but-i-cant-complain,1,"April 24, 2021"
Least Valuable N.F.T.s,https://www.newyorker.com//humor/daily-shouts/least-valuable-nfts,1,"April 23, 2021"
"Daily Cartoon: Friday, April 23rd",https://www.newyorker.com//cartoons/daily-cartoon/friday-april-23rd-tv-movie,1,"April 23, 2021"
Trailer for a Prequel to Alfred Hitchcock’s “The Birds”,https://www.newyorker.com//humor/daily-shouts/trailer-for-a-prequel-to-alfred-hitchcocks-the-birds,1,"April 23, 2021"
Conspiracy Theorists Critique Your Floral Arrangements,https://www.newyorker.com//humor/daily-shouts/conspiracy-theorists-critique-your-floral-arrangments,1,"April 22, 2021"
"Daily Cartoon: Thursday, April 22nd",https://www.newyorker.com//cartoons/daily-cartoon/thursday-april-22nd-presentation-repetition,1,"April 22, 2021"
Biden Announces Plan to Cut Carlson Emissions by Ninety Per Cent,https://www.newyorker.com//humor/borowitz-report/biden-announces-plan-to-cut-carlson-emissions-by-ninety-per-cent,1,"April 22, 2021"
An N.C.A.A. Press Release on Gender Disparity,https://www.newyorker.com//humor/daily-shouts/an-ncaa-press-release-on-gender-disparity,1,"April 22, 2021"
"Daily Cartoon: Wednesday, April 21st",https://www.newyorker.com//cartoons/daily-cartoon/wednesday-april-21st-raining-masks,1,"April 21, 2021"
What I Imagine Strangers Think About Me When They See Me Reading a Book in Public,https://www.newyorker.com//humor/daily-shouts/what-i-imagine-strangers-think-about-me-when-they-see-me-reading-a-book-in-public,1,"April 21, 2021"
Conquer the Day: Visualizing a Better Self,https://www.newyorker.com//humor/daily-shouts/conquer-the-day-visualizing-a-better-self,1,"April 20, 2021"
Republicans Blame Biden for Making Millions of Americans’ Arms Hurt,https://www.newyorker.com//humor/borowitz-report/republicans-blame-biden-for-making-millions-of-americans-arms-hurt,1,"April 20, 2021"
"Daily Cartoon: Tuesday, April 20th",https://www.newyorker.com//cartoons/daily-cartoon/tuesday-april-20th-bad-breath,1,"April 20, 2021"
What the New Roaring Twenties Will Be Like,https://www.newyorker.com//humor/daily-shouts/what-the-new-roaring-twenties-will-be-like,1,"April 20, 2021"
"Bonus Daily Cartoon: Monday, April 19th",https://www.newyorker.com//cartoons/daily-cartoon/bonus-daily-cartoon-monday-april-19th-color-blind-police,1,"April 19, 2021"
