headline,article_link,is_sarcastic,date
What Happens to All the Un-Hugged Hugs?,https://www.newyorker.com//humor/daily-shouts/what-happens-to-all-the-un-hugged-hugs,1,"June 4, 2020"
Trump’s Bleach Moment Now Seeming Like Career High Point,https://www.newyorker.com//humor/borowitz-report/trumps-bleach-moment-now-seeming-like-career-high-point,1,"June 4, 2020"
"Daily Cartoon: Thursday, June 4th",https://www.newyorker.com//cartoons/daily-cartoon/thursday-june-4th-just-getting-started,1,"June 4, 2020"
Social-Media Challenges That Are Too Complicated to Go Viral,https://www.newyorker.com//humor/daily-shouts/social-media-challenges-that-are-too-complicated-to-go-viral,1,"June 4, 2020"
Trump Says Inspection Revealed Bunker Was Dusty Because Obama Never Used It,https://www.newyorker.com//humor/borowitz-report/trump-says-inspection-revealed-bunker-was-dusty-because-obama-never-used-it,1,"June 3, 2020"
Your Twenties as Video-Game Achievements,https://www.newyorker.com//humor/daily-shouts/your-twenties-as-video-game-achievements,1,"June 3, 2020"
"Daily Cartoon: Wednesday, June 3rd",https://www.newyorker.com//cartoons/daily-cartoon/wednesday-june-3rd-dominating-yet,1,"June 3, 2020"
A Homeschool Report Card in the COVID-19 Era,https://www.newyorker.com//humor/daily-shouts/a-homeschool-report-card-in-the-covid-era,1,"June 3, 2020"
Some Bummertime Streaming,https://www.newyorker.com//humor/daily-shouts/some-bummertime-streaming,1,"June 2, 2020"
"Daily Cartoon: Tuesday, June 2nd",https://www.newyorker.com//cartoons/daily-cartoon/tuesday-june-2nd-one-article,1,"June 2, 2020"
The Best and Worst Heckles from Robot Baseball Fans,https://www.newyorker.com//humor/daily-shouts/the-best-and-worst-heckles-from-robot-baseball-fans,1,"June 2, 2020"
"Are You Social-Distancing, or Are You Colin from “The Secret Garden”?",https://www.newyorker.com//humor/daily-shouts/are-you-social-distancing-or-are-you-colin-from-the-secret-garden,1,"June 1, 2020"
Study: Many of Nation’s Problems Could Be Solved by Having a President,https://www.newyorker.com//humor/borowitz-report/study-says-many-of-nations-problems-could-be-solved-by-having-a-president,1,"June 1, 2020"
"Daily Cartoon: Monday, June 1st",https://www.newyorker.com//cartoons/daily-cartoon/monday-june-1st-bang-trim,1,"June 1, 2020"
New Acceptable Forms of Patriotism in 2020,https://www.newyorker.com//humor/daily-shouts/new-acceptable-forms-of-patriotism-in-2020,1,"May 31, 2020"
Angela Merkel Practices Social Distancing by Staying Four Thousand Miles Away from Trump,https://www.newyorker.com//humor/borowitz-report/angela-merkel-practices-social-distancing-by-staying-four-thousand-miles-away-from-trump,1,"May 30, 2020"
Things I’ve Googled Recently,https://www.newyorker.com//humor/daily-shouts/things-ive-googled-recently,1,"May 30, 2020"
Ways to Measure Time When Time Has Lost Its Meaning,https://www.newyorker.com//humor/daily-shouts/ways-to-measure-time-when-time-has-lost-its-meaning,1,"May 29, 2020"
Nation Astonished by Spectacle of Twitter Management Demonstrating Responsibility,https://www.newyorker.com//humor/borowitz-report/nation-astonished-by-spectacle-of-twitter-management-demonstrating-responsibility,1,"May 29, 2020"
"Daily Cartoon: Friday, May 29th",https://www.newyorker.com//cartoons/daily-cartoon/friday-may-29th-quarantine-bears,1,"May 29, 2020"
The Pre-Apocalyptic Novels We All Need Right Now,https://www.newyorker.com//humor/daily-shouts/the-pre-apocalyptic-novels-we-all-need-right-now,1,"May 29, 2020"
The New Army Men,https://www.newyorker.com//humor/daily-shouts/the-new-army-men,1,"May 28, 2020"
"Daily Cartoon: Thursday, May 28th",https://www.newyorker.com//cartoons/daily-cartoon/thursday-may-28th-dystopia-utopia,1,"May 28, 2020"
Twitter’s Servers Burst Into Flames After Attempting to Fact-Check All of Trump’s Tweets,https://www.newyorker.com//humor/borowitz-report/twitters-servers-burst-into-flames-after-attempting-to-fact-check-all-of-trumps-tweets,1,"May 28, 2020"
What’s a “Pantry Staple”?: True Stories from the Cluelessly Quarantined,https://www.newyorker.com//humor/daily-shouts/whats-a-pantry-staple-true-stories-from-the-cluelessly-quarantined,1,"May 28, 2020"
Trump Lashes Out at Spell-Check for Treating Him Unfairly,https://www.newyorker.com//humor/borowitz-report/trump-lashes-out-at-spell-check-for-treating-him-unfairly,1,"May 27, 2020"
Goodnight Zoom,https://www.newyorker.com//humor/daily-shouts/goodnight-zoom,1,"May 27, 2020"
"Daily Cartoon: Wednesday, May 27th",https://www.newyorker.com//cartoons/daily-cartoon/wednesday-may-27th-family-escape,1,"May 27, 2020"
Trump Demands That Republican Convention Move from North Carolina to Moscow,https://www.newyorker.com//humor/borowitz-report/trump-demands-that-republican-convention-move-from-north-carolina-to-moscow,1,"May 27, 2020"
Dispatches from the Front Lines of the Streaming Wars,https://www.newyorker.com//humor/daily-shouts/dispatches-from-the-front-lines-of-the-streaming-wars,1,"May 27, 2020"
Initial Interpretations of Quarantine Terms Before I Knew What They Meant,https://www.newyorker.com//humor/daily-shouts/initial-interpretations-of-quarantine-terms-before-i-knew-what-they-meant,1,"May 26, 2020"
"Daily Cartoon: Tuesday, May 26th",https://www.newyorker.com//cartoons/daily-cartoon/tuesday-may-26th-new-calendar,1,"May 26, 2020"
Events We Are Actually Glad Were Cancelled,https://www.newyorker.com//humor/daily-shouts/events-we-are-actually-glad-were-cancelled,1,"May 26, 2020"
How My Misdirected Feelings Have Come Out Lately,https://www.newyorker.com//humor/daily-shouts/how-my-misdirected-feelings-have-come-out-lately,1,"May 25, 2020"
"Daily Cartoon: Monday, May 25th",https://www.newyorker.com//cartoons/daily-cartoon/monday-may-25th-the-end-is-near,1,"May 25, 2020"
Fauci Urges Trump to Remain on Golf Course Until Pandemic Is Over,https://www.newyorker.com//humor/borowitz-report/fauci-urges-trump-to-remain-on-golf-course-until-pandemic-is-over,1,"May 24, 2020"
Difficult Conversations You Can Segue Into While Doing a Jigsaw Puzzle,https://www.newyorker.com//humor/daily-shouts/difficult-conversations-you-can-segue-into-while-doing-a-jigsaw-puzzle,1,"May 24, 2020"
What Did You Do Today?,https://www.newyorker.com//humor/daily-shouts/what-did-you-do-today,1,"May 23, 2020"
On Being Gainfully Unemployed,https://www.newyorker.com//humor/daily-shouts/on-being-gainfully-unemployed,1,"May 22, 2020"
"Daily Cartoon: Friday, May 22nd",https://www.newyorker.com//cartoons/daily-cartoon/friday-may-22nd-escape,1,"May 22, 2020"
Batman Works from Home,https://www.newyorker.com//humor/daily-shouts/batman-works-from-home,1,"May 22, 2020"
Your Spotify Quarantine-in-Review,https://www.newyorker.com//humor/daily-shouts/your-spotify-quarantine-in-review,1,"May 21, 2020"
"Daily Cartoon: Thursday, May 21st",https://www.newyorker.com//cartoons/daily-cartoon/thursday-may-21st-royal-science,1,"May 21, 2020"
“Hope You’re Staying Sane”: A Coronavirus E-mail Chain,https://www.newyorker.com//humor/daily-shouts/hope-youre-staying-sane-a-coronavirus-e-mail-chain,1,"May 21, 2020"
The Jaded Quitters Club,https://www.newyorker.com//humor/daily-shouts/the-jaded-quitters-club,1,"May 20, 2020"
"Daily Cartoon: Wednesday, May 20th",https://www.newyorker.com//cartoons/daily-cartoon/wednesday-may-20th-animal-crossing,1,"May 20, 2020"
Trump Fears Painting of Obama at White House Would Spy on Him,https://www.newyorker.com//humor/borowitz-report/trump-fears-painting-of-obama-at-white-house-would-spy-on-him,1,"May 20, 2020"
Quarantine Lessons from Alfred Hitchcock,https://www.newyorker.com//humor/daily-shouts/quarantine-lessons-from-alfred-hitchcock,1,"May 20, 2020"
How to Spend Your Stimulus Check,https://www.newyorker.com//humor/daily-shouts/how-to-spend-your-stimulus-check,1,"May 19, 2020"
"Daily Cartoon: Tuesday, May 19th",https://www.newyorker.com//cartoons/daily-cartoon/monday-may-19th-welcome-distraction,1,"May 19, 2020"
Dr. Clifton’s Fantastical Miracle Elixir Return Policy,https://www.newyorker.com//humor/daily-shouts/dr-cliftons-fantastical-miracle-elixir-return-policy,1,"May 19, 2020"
New Test Indicates Hydroxychloroquine Causes Delusions,https://www.newyorker.com//humor/borowitz-report/new-test-indicates-hydroxychloroquine-causes-delusions,1,"May 18, 2020"
Do I Have to Get Up Yet?: A Flowchart,https://www.newyorker.com//humor/daily-shouts/do-i-have-to-get-up-yet-a-flowchart,1,"May 18, 2020"
Trump Orders Pence to Start Picking Up Pompeo’s Laundry,https://www.newyorker.com//humor/borowitz-report/trump-orders-pence-to-start-picking-up-pompeos-laundry,1,"May 18, 2020"
"Daily Cartoon: Monday, May 18th",https://www.newyorker.com//cartoons/daily-cartoon/monday-may-18th-close-facsimile,1,"May 18, 2020"
Ghosts of the Apollo,https://www.newyorker.com//humor/daily-shouts/ghosts-of-the-apollo-theatre,1,"May 17, 2020"
Trump Says Nation Will Have Vaccine Before It Sees His Taxes,https://www.newyorker.com//humor/borowitz-report/trump-says-nation-will-have-vaccine-before-it-sees-his-taxes,1,"May 16, 2020"
I Got Another “Failed Delivery Attempt” from the Stork Delivering My Baby,https://www.newyorker.com//humor/daily-shouts/i-got-another-failed-delivery-attempt-from-the-stork-delivering-my-baby,1,"May 16, 2020"
What’s Behind Window No. 1?,https://www.newyorker.com//humor/daily-shouts/whats-behind-window-no-1,1,"May 15, 2020"
"Daily Cartoon: Friday, May 15th",https://www.newyorker.com//cartoons/daily-cartoon/friday-may-15th-hell-on-fire,1,"May 15, 2020"
Questions for Scientists During Any Downtime They Might Have,https://www.newyorker.com//humor/daily-shouts/questions-for-scientists-during-any-downtime-they-might-have,1,"May 15, 2020"
I Got a Cat,https://www.newyorker.com//humor/daily-shouts/i-got-a-cat,1,"May 14, 2020"
Trump Wishes He Could Replace Fauci with the Doctor Who Saved Him from Vietnam,https://www.newyorker.com//humor/borowitz-report/trump-wishes-he-could-replace-fauci-with-the-doctor-who-saved-him-from-vietnam,1,"May 14, 2020"
"Daily Cartoon: Thursday, May 14th",https://www.newyorker.com//cartoons/daily-cartoon/thursday-may-14th-looming-danger,1,"May 14, 2020"
Recent Headlines from Hang Gliding Daily Magazine,https://www.newyorker.com//humor/daily-shouts/recent-headlines-from-hang-gliding-daily-magazine,1,"May 14, 2020"
P.I.M.: Pandemic-Induced Malaise,https://www.newyorker.com//humor/daily-shouts/pim-pandemic-induced-malaise,1,"May 13, 2020"
Rand Paul Says Secret to Social Distancing Is Making Everyone Despise You,https://www.newyorker.com//humor/borowitz-report/rand-paul-says-secret-to-social-distancing-is-making-everyone-despise-you,1,"May 13, 2020"
"Daily Cartoon: Wednesday, May 13th",https://www.newyorker.com//cartoons/daily-cartoon/wednesday-may-13th-movie-line,1,"May 13, 2020"
"Now Is the Time to Cherish the Little Things, by Jeff Bezos",https://www.newyorker.com//humor/daily-shouts/now-is-the-time-to-cherish-the-little-things-by-jeff-bezos,1,"May 13, 2020"
Advantages to Postponing Your Wedding During a Pandemic,https://www.newyorker.com//humor/daily-shouts/advantages-to-postponing-your-wedding-during-a-pandemic,1,"May 12, 2020"
"Daily Cartoon: Tuesday, May 12th",https://www.newyorker.com//cartoons/daily-cartoon/tuesday-may-12th-asteroid-virus,1,"May 12, 2020"
"Updated Possibilities for This Year’s October Surprise, Given 2020 So Far",https://www.newyorker.com//humor/daily-shouts/updated-possibilities-for-this-years-october-surprise-given-2020-so-far,1,"May 12, 2020"
Obama Unworried About Trump Accusing Him of Crime Because Bill Barr Does Not Prosecute Criminals,https://www.newyorker.com//humor/borowitz-report/obama-unworried-about-trump-accusing-him-of-crime-because-bill-barr-does-not-prosecute-criminals,1,"May 11, 2020"
In Search of a Good Night’s Rest,https://www.newyorker.com//humor/daily-shouts/in-search-of-a-good-nights-rest,1,"May 11, 2020"
Susan Collins to Self-Quarantine to Avoid Possible Contact with Decisions,https://www.newyorker.com//humor/borowitz-report/susan-collins-to-self-quarantine-to-avoid-possible-contact-with-decisions,1,"May 11, 2020"
"Daily Cartoon: Monday, May 11th",https://www.newyorker.com//cartoons/daily-cartoon/monday-may-11th-go-outside,1,"May 11, 2020"
Imagined Histories of Artists and Their Parents,https://www.newyorker.com//humor/daily-shouts/imagined-histories-of-artists-and-their-parents,1,"May 10, 2020"
Your Virtual Cruise F.A.Q.,https://www.newyorker.com//humor/daily-shouts/your-virtual-cruise-faq,1,"May 9, 2020"
In These Difficult Times,https://www.newyorker.com//humor/daily-shouts/in-these-difficult-times,1,"May 8, 2020"
Bill Barr Tests Negative for Integrity,https://www.newyorker.com//humor/borowitz-report/bill-barr-tests-negative-for-integrity,1,"May 8, 2020"
"Daily Cartoon: Friday, May 8th",https://www.newyorker.com//cartoons/daily-cartoon/friday-may-8th-desk-salad,1,"May 8, 2020"
Only Nineties Kids Will Remember the Way Things Used to Be,https://www.newyorker.com//humor/daily-shouts/only-nineties-kids-will-remember-the-way-things-used-to-be,1,"May 8, 2020"
A Real New Yorker,https://www.newyorker.com//humor/daily-shouts/a-real-new-yorker,1,"May 7, 2020"
Unskilled American Somehow Still Employed,https://www.newyorker.com//humor/borowitz-report/unskilled-american-somehow-still-employed,1,"May 7, 2020"
"Daily Cartoon: Thursday, May 7th",https://www.newyorker.com//cartoons/daily-cartoon/thursday-may-7th-bad-haircut,1,"May 7, 2020"
Alternative Currencies for a New Economy,https://www.newyorker.com//humor/daily-shouts/alternative-currencies-for-a-new-economy,1,"May 7, 2020"
Rejected Animal Crossing Villagers,https://www.newyorker.com//humor/daily-shouts/rejected-animal-crossing-villagers,1,"May 6, 2020"
Coronavirus Task Force Officially Split as Fauci Announces Solo Album,https://www.newyorker.com//humor/borowitz-report/coronavirus-task-force-officially-split-as-fauci-announces-solo-album,1,"May 6, 2020"
"Daily Cartoon: Wednesday, May 6th",https://www.newyorker.com//cartoons/daily-cartoon/wednesday-may-6th-work-home,1,"May 6, 2020"
A First Date Immediately Following Quarantine,https://www.newyorker.com//humor/daily-shouts/a-first-date-immediately-following-quarantine,1,"May 6, 2020"
A Guide to Reading Facial Expressions Behind Protective Masks,https://www.newyorker.com//humor/daily-shouts/a-guide-to-reading-facial-expressions-behind-protective-masks,1,"May 5, 2020"
Murder Hornets Doubt They Can Do as Much Damage as Trump,https://www.newyorker.com//humor/borowitz-report/murder-hornets-doubt-they-can-do-as-much-damage-as-trump,1,"May 5, 2020"
"Daily Cartoon: Tuesday, May 5th",https://www.newyorker.com//cartoons/daily-cartoon/tuesday-may-5th-pandemic-ghost,1,"May 5, 2020"
"We’re Sorry, the America You Ordered Is Currently Unavailable",https://www.newyorker.com//humor/daily-shouts/were-sorry-the-america-you-ordered-is-currently-unavailable,1,"May 5, 2020"
“The Sopranos” Under Quarantine,https://www.newyorker.com//humor/daily-shouts/the-sopranos-under-quarantine,1,"May 4, 2020"
New Claim That Enemies of U.S. Developed Trump in Lab,https://www.newyorker.com//humor/borowitz-report/new-claim-that-enemies-of-us-developed-trump-in-lab,1,"May 4, 2020"
"Daily Cartoon: Monday, May 4th",https://www.newyorker.com//cartoons/daily-cartoon/monday-may-4th-demons,1,"May 4, 2020"
Some Minimalist Bookshelves,https://www.newyorker.com//humor/daily-shouts/some-minimalist-bookshelves,1,"May 3, 2020"
"Blocked From Testifying, Fauci Plans Zoom Call with Entire Country",https://www.newyorker.com//humor/borowitz-report/blocked-from-testifying-fauci-plans-zoom-call-with-entire-country,1,"May 2, 2020"
How to Relax with a Candle While Thoroughly Following Candle-Safety Protocol,https://www.newyorker.com//humor/daily-shouts/how-to-relax-with-a-candle-while-thoroughly-following-candle-safety-protocol,1,"May 2, 2020"
Some Ways That I’m O.K. Dying,https://www.newyorker.com//humor/daily-shouts/some-ways-that-im-ok-dying,1,"May 1, 2020"
Michigan Governor Arrogantly Forcing Residents to Remain Alive,https://www.newyorker.com//humor/borowitz-report/michigan-governor-arrogantly-forcing-residents-to-remain-alive,1,"May 1, 2020"
"Daily Cartoon: Friday, May 1st",https://www.newyorker.com//cartoons/daily-cartoon/friday-may-1st-mirror-mirror,1,"May 1, 2020"
How Are You Doing with All of This?,https://www.newyorker.com//humor/daily-shouts/how-are-you-doing-with-all-of-this,1,"May 1, 2020"
Brought to You by the Letter “C”,https://www.newyorker.com//humor/daily-shouts/brought-to-you-by-the-letter-c,1,"April 30, 2020"
"Daily Cartoon: Thursday, April 30th",https://www.newyorker.com//cartoons/daily-cartoon/thursday-april-30th-fire-extinguisher,1,"April 30, 2020"
Corporate Jargon Adjusted for Quarantine,https://www.newyorker.com//humor/daily-shouts/corporate-jargon-adjusted-for-quarantine,1,"April 30, 2020"
How Quarantine Changed Me,https://www.newyorker.com//humor/daily-shouts/how-quarantine-changed-me,1,"April 29, 2020"
"Daily Cartoon: Wednesday, April 29th",https://www.newyorker.com//cartoons/daily-cartoon/wednesday-april-29th-novel-crisis,1,"April 29, 2020"
Pence Starts Wearing Mask After Fauci Says It Will Protect Him from Women,https://www.newyorker.com//humor/borowitz-report/pence-starts-wearing-mask-after-fauci-says-it-will-protect-him-from-women,1,"April 29, 2020"
Goings On About Home,https://www.newyorker.com//humor/daily-shouts/goings-on-about-home,1,"April 29, 2020"
Some Causes of Pandemic-Related Video Conflict,https://www.newyorker.com//humor/daily-shouts/some-causes-of-pandemic-related-video-conflict,1,"April 28, 2020"
CNN to Show Phone Number of Poison-Control Hotline Whenever Trump Speaks,https://www.newyorker.com//humor/borowitz-report/cnn-to-show-phone-number-of-poison-control-hotline-whenever-trump-speaks,1,"April 28, 2020"
"Daily Cartoon: Tuesday, April 28th",https://www.newyorker.com//cartoons/daily-cartoon/tuesday-april-28th-trojan-horse,1,"April 28, 2020"
Quarantine Missed Connections,https://www.newyorker.com//humor/daily-shouts/quarantine-missed-connections,1,"April 28, 2020"
Hunkering Down with Eddy,https://www.newyorker.com//humor/daily-shouts/hunkering-down-with-eddy,1,"April 27, 2020"
Trump Blames Plummeting Poll Numbers on People Paying Attention When He Talks,https://www.newyorker.com//humor/borowitz-report/trump-blames-plummeting-poll-numbers-on-people-paying-attention-when-he-talks,1,"April 27, 2020"
"Daily Cartoon: Monday, April 27th",https://www.newyorker.com//cartoons/daily-cartoon/monday-april-27th-work-from-home,1,"April 27, 2020"
What to Think About in the Morning Before You Remember the Sad State of the World,https://www.newyorker.com//humor/daily-shouts/what-to-think-about-in-the-morning-before-you-remember-the-sad-state-of-the-world,1,"April 26, 2020"
Experts Believe the Coronavirus Could Be Defeated with the Twenty-fifth Amendment,https://www.newyorker.com//humor/borowitz-report/experts-believe-the-coronavirus-could-be-defeated-with-the-twenty-fifth-amendment,1,"April 25, 2020"
How to Spot a Fake,https://www.newyorker.com//humor/daily-shouts/how-to-spot-a-fake,1,"April 25, 2020"
Trump Advises States Facing Bankruptcy to Borrow Millions from Their Dads,https://www.newyorker.com//humor/borowitz-report/trump-advises-states-facing-bankruptcy-to-borrow-millions-from-their-dads,1,"April 24, 2020"
America!: Dr. Fauci Reads a Bedtime Story to Anxious Adults,https://www.newyorker.com//humor/daily-shouts/america-dr-fauci-reads-a-bedtime-story-to-anxious-adults,1,"April 24, 2020"
America’s Four-Year-Olds Warn Against Following Trump’s Medical Advice,https://www.newyorker.com//humor/borowitz-report/americas-four-year-olds-warn-against-following-trumps-medical-advice,1,"April 24, 2020"
"Daily Cartoon: Friday, April 24th",https://www.newyorker.com//cartoons/daily-cartoon/friday-april-24th-face-masks,1,"April 24, 2020"
Homeschool Spirit Week!,https://www.newyorker.com//humor/daily-shouts/homeschool-spirit-week,1,"April 24, 2020"
The American Girl Pandemic Collection,https://www.newyorker.com//humor/daily-shouts/the-american-girl-pandemic-collection,1,"April 23, 2020"
"Substitutions in the Time of Quarantine, Rated",https://www.newyorker.com//humor/daily-shouts/substitutions-in-the-time-of-quarantine-rated,1,"April 23, 2020"
"Daily Cartoon: Thursday, April 23rd",https://www.newyorker.com//cartoons/daily-cartoon/thursday-april-23rd-stockpile-whoops,1,"April 23, 2020"
Some Different Scary Things to Dwell on All Day,https://www.newyorker.com//humor/daily-shouts/some-different-scary-things-to-dwell-on-all-day,1,"April 23, 2020"
Texas’s Lieutenant Governor Says Dying Not as Bad as Living in State Where He Is Lieutenant Governor,https://www.newyorker.com//humor/borowitz-report/texass-lieutenant-governor-says-dying-not-as-bad-as-living-in-state-where-he-is-lieutenant-governor,1,"April 22, 2020"
How My Soviet Mom Prepared Me for the Coronavirus Pandemic,https://www.newyorker.com//humor/daily-shouts/how-my-soviet-mom-prepared-me-for-the-coronavirus-pandemic,1,"April 22, 2020"
"Daily Cartoon: Wednesday, April 22nd",https://www.newyorker.com//cartoons/daily-cartoon/wednesday-april-22nd-earth-day,1,"April 22, 2020"
Quarantine Conversation Starters,https://www.newyorker.com//humor/daily-shouts/quarantine-conversation-starters,1,"April 22, 2020"
Pride and Pestilence,https://www.newyorker.com//humor/daily-shouts/pride-and-pestilence,1,"April 21, 2020"
"Daily Cartoon: Tuesday, April 21st",https://www.newyorker.com//cartoons/daily-cartoon/tuesday-april-21st-coronavirus-cinderella,1,"April 21, 2020"
Cuomo Says Florida Beachgoers Travelling to New York Must First Be Tested for I.Q.,https://www.newyorker.com//humor/borowitz-report/cuomo-says-florida-beachgoers-travelling-to-new-york-must-first-be-tested-for-iq,1,"April 20, 2020"
The Post-Coronavirus Art World,https://www.newyorker.com//humor/daily-shouts/the-post-coronavirus-art-world,1,"April 20, 2020"
Nation’s Parents Fear That if Kids Miss Enough School They Will Turn Out Like Betsy DeVos,https://www.newyorker.com//humor/borowitz-report/nations-parents-fear-that-if-kids-miss-enough-school-they-will-turn-out-like-betsy-devos,1,"April 20, 2020"
"Daily Cartoon: Monday, April 20th",https://www.newyorker.com//cartoons/daily-cartoon/monday-april-20th-marie-kondo,1,"April 20, 2020"
How to Meal-Prep for Self-Quarantine,https://www.newyorker.com//humor/daily-shouts/how-to-meal-prep-for-self-quarantine,1,"April 19, 2020"
Love Poems for Anxious People,https://www.newyorker.com//humor/daily-shouts/love-poems-for-anxious-people,1,"April 18, 2020"
Dr. Oz Fears That Coronavirus Comments Could Hurt His Credibility as Expert on Magic Beans,https://www.newyorker.com//humor/borowitz-report/dr-oz-fears-that-coronavirus-comments-could-hurt-his-credibility-as-expert-on-magic-beans,1,"April 17, 2020"
Some Drawings from Week Three at Home,https://www.newyorker.com//humor/daily-shouts/some-drawings-from-week-three-at-home,1,"April 17, 2020"
"Daily Cartoon: Friday, April 17th",https://www.newyorker.com//cartoons/daily-cartoon/friday-april-17th-zoom-workout,1,"April 17, 2020"
Fauci: No Evidence That Warmer Weather Will Make Trump Disappear,https://www.newyorker.com//humor/borowitz-report/fauci-no-evidence-that-warmer-weather-will-make-trump-disappear,1,"April 17, 2020"
A Plague-Month Journal,https://www.newyorker.com//humor/daily-shouts/a-plague-month-journal,1,"April 17, 2020"
My New Friends!,https://www.newyorker.com//humor/daily-shouts/my-new-friends,1,"April 16, 2020"
"Daily Cartoon: Thursday, April 16th",https://www.newyorker.com//cartoons/daily-cartoon/thursday-april-16th-constitutional-time-travel,1,"April 16, 2020"
How to Cut Your Bangs During a Global Crisis,https://www.newyorker.com//humor/daily-shouts/how-to-cut-your-bangs-during-a-global-crisis,1,"April 16, 2020"
Trump Defends Decision to Sign Stimulus Checks: “I Want My Name to Be Synonymous With the Coronavirus”,https://www.newyorker.com//humor/borowitz-report/trump-defends-decision-to-sign-stimulus-checks-i-want-my-name-to-be-synonymous-with-the-coronavirus,1,"April 15, 2020"
P.S.A. Posters for Living Indoors,https://www.newyorker.com//humor/daily-shouts/psa-posters-for-living-indoors,1,"April 15, 2020"
"Trump Says the Three Things He Hates Most Are the World, Health, and Organization",https://www.newyorker.com//humor/borowitz-report/trump-says-the-three-things-he-hates-most-are-the-world-health-and-organization,1,"April 15, 2020"
"Daily Cartoon: Wednesday, April 15th",https://www.newyorker.com//cartoons/daily-cartoon/wednesday-april-15th-quarantine-fatigue,1,"April 15, 2020"
Netflix Documentaries We Watched While Under Quarantine,https://www.newyorker.com//humor/daily-shouts/netflix-documentaries-we-watched-while-under-quarantine,1,"April 15, 2020"
Is COVID-19 the Apocalypse? Generations React,https://www.newyorker.com//humor/daily-shouts/is-covid-19-the-apocalypse-generations-react,1,"April 14, 2020"
National Archives Report Someone Tried to Scrawl “Total Authority” with Sharpie on U.S. Constitution,https://www.newyorker.com//humor/borowitz-report/national-archives-report-someone-tried-to-scrawl-total-authority-with-sharpie-on-us-constitution,1,"April 14, 2020"
"Daily Cartoon: Tuesday, April 14th",https://www.newyorker.com//cartoons/daily-cartoon/tuesday-april-14th-piggy-bank,1,"April 14, 2020"
A Grateful Grandfather Sheltering with His Family,https://www.newyorker.com//humor/daily-shouts/a-grateful-grandfather-sheltering-with-his-family,1,"April 14, 2020"
Study: No One Could Have Seen Pandemic Coming Except People Capable of Reading,https://www.newyorker.com//humor/borowitz-report/study-no-one-could-have-seen-pandemic-coming-except-people-capable-of-reading,1,"April 13, 2020"
Meet the Russian Trolls Meddling in Your Election,https://www.newyorker.com//humor/daily-shouts/meet-the-russian-trolls-meddling-in-your-election,1,"April 13, 2020"
Nation’s Governors Consider Forming Country,https://www.newyorker.com//humor/borowitz-report/nations-governors-consider-forming-country,1,"April 13, 2020"
